{
  "schema_version": "scogo.taskgen.task.v2",
  "prompt": "Investigate a suspected BGP route leak using read-only evidence before proposing a bounded repair.",
  "category": "enterprise_netops",
  "domain": "layer3_routing",
  "subdomain": "bgp_route_leak",
  "difficulty": 8,
  "coordinates": {
    "taxonomy_id": "scogo-enterprise-netops-v2",
    "category_id": "enterprise_netops",
    "task_family": "troubleshooting_rca",
    "environment": "hybrid",
    "platform_scope": "multi_platform",
    "platforms": ["cisco_ios_xe", "juniper_junos"],
    "incident_mechanism": "misconfiguration",
    "evidence_condition": "contradictory",
    "evidence_bundle": "routing_tables",
    "action_risk": "read_only_investigation",
    "presentation": "war_room"
  },
  "taskgen_model": "teacher/model",
  "temperature": 0.9
}
